analysis/v1.5/rollout_local-vllm_Qwen_Qwen3-4B_14988_qwen3_4b_no_think_no_all_voted_termination_preference_scenarios/preference_scenario_metrics_summary.json

[
  {
    "avg_social_welfare_efficiency": 0.7464781335749078,
    "avg_tokens_used": 179.11111111111111,
    "avg_total_turns": 9.0,
    "category_counts": "instant_decision=3, negotiation=6",
    "consensus_rate": 0.7777777777777778,
    "episodes": 9,
    "percent": 0.09,
    "scenario": "all_three_share_top",
    "socially_optimal_given_consensus_rate": 0.7142857142857143,
    "socially_optimal_rate": 0.5555555555555556
  },
  {
    "avg_social_welfare_efficiency": 0.8319458594139185,
    "avg_tokens_used": 126.11111111111111,
    "avg_total_turns": 7.277777777777778,
    "category_counts": "instant_decision=7, negotiation=11",
    "consensus_rate": 0.8888888888888888,
    "episodes": 18,
    "percent": 0.18,
    "scenario": "only_prof_1_prof_2_share_top",
    "socially_optimal_given_consensus_rate": 0.5,
    "socially_optimal_rate": 0.4444444444444444
  },
  {
    "avg_social_welfare_efficiency": 0.9429804213254241,
    "avg_tokens_used": 147.61904761904762,
    "avg_total_turns": 8.0,
    "category_counts": "instant_decision=3, negotiation=18",
    "consensus_rate": 1.0,
    "episodes": 21,
    "percent": 0.21,
    "scenario": "only_prof_1_prof_3_share_top",
    "socially_optimal_given_consensus_rate": 0.47619047619047616,
    "socially_optimal_rate": 0.47619047619047616
  },
  {
    "avg_social_welfare_efficiency": 0.8838486590808572,
    "avg_tokens_used": 100.58823529411765,
    "avg_total_turns": 5.470588235294118,
    "category_counts": "instant_decision=6, negotiation=11",
    "consensus_rate": 1.0,
    "episodes": 17,
    "percent": 0.17,
    "scenario": "only_prof_2_prof_3_share_top",
    "socially_optimal_given_consensus_rate": 0.4117647058823529,
    "socially_optimal_rate": 0.4117647058823529
  },
  {
    "avg_social_welfare_efficiency": 0.8127232056393722,
    "avg_tokens_used": 137.97142857142856,
    "avg_total_turns": 7.6,
    "category_counts": "instant_decision=11, negotiation=24",
    "consensus_rate": 0.8571428571428571,
    "episodes": 35,
    "percent": 0.35,
    "scenario": "no_pair_shares_top",
    "socially_optimal_given_consensus_rate": 0.5333333333333333,
    "socially_optimal_rate": 0.45714285714285713
  }
]

analysis/v1.5/rollout_local-vllm_Qwen_Qwen3-4B_14988_qwen3_4b_no_think_no_all_voted_termination_preference_scenarios/preference_scenario_metrics_summary.md

## all_three_share_top

- episodes: `9`
- percent of analyzed episodes: `0.090`
- consensus rate: `0.778`
- SO rate: `0.556`
- SO|cons rate: `0.714`

## only_prof_1_prof_2_share_top

- episodes: `18`
- percent of analyzed episodes: `0.180`
- consensus rate: `0.889`
- SO rate: `0.444`
- SO|cons rate: `0.500`

## no_pair_shares_top

- episodes: `35`
- percent of analyzed episodes: `0.350`
- consensus rate: `0.857`
- SO rate: `0.457`
- SO|cons rate: `0.533`